{
  "schema_version": "session/1",
  "session_id": "7c9b2b1e-6b6d-4f7a-9d3e-1a2b3c4d5e6f",
  "owner_id": "11111111-1111-4111-8111-111111111111",
  "title": "週次定例: ロードマップ確認",
  "title_edited_by_user": false,
  "title_revision": 1,
  "input_kind": "recorded_dual_track",
  "language_mode": "auto",
  "allow_external_send": true,
  "format_snapshot": null,
  "status": "completed",
  "failure": null,
  "started_at": "2026-09-12T10:00:00+09:00",
  "duration_ms": 1800000,
  "created_at": "2026-09-12T10:30:10+09:00",
  "updated_at": "2026-09-12T11:20:00+09:00",
  "tracks": [
    { "track_id": "app-audio", "role": "app", "upload_state": "completed", "upload_id": null, "upload_url": null, "upload_expires_at": null, "artifact_id": "art_01J7Q0AAAAAAAAAAAAAAAAAAA1" },
    { "track_id": "microphone", "role": "microphone", "upload_state": "completed", "upload_id": null, "upload_url": null, "upload_expires_at": null, "artifact_id": "art_01J7Q0AAAAAAAAAAAAAAAAAAA2" }
  ],
  "current_minutes_version_id": "c1d2e3f4-a5b6-4c7d-8e9f-0a1b2c3d4e5f",
  "transcript_revision": 1,
  "review_count": 1,
  "audio_retained": true,
  "audio_expires_at": "2026-10-12T10:30:10+09:00",
  "shared_with": [],
  "is_shared_view": false
}
